{
    "title": {
        "en": "INTERMEDIATEBULK",
        "fr": "INTERMEDIATEBULK"
    },
    "name": "INTERMEDIATE BULK CONTAINERS DESIGN AND MANUFACTURE FOR THE TRANSPORTATION OF DANGEROUS GOODS PURSUANT TO PART 1 OF CGSB-43.146-2002",
    "groups": [
        {
            "title": {
                "en": "COMPANY DETAILS",
                "fr": "DÉTAILS DE LA COMPAGNIE"
            },
            "primaryKey": "GRP_CMPNYDTLS_TMPLT_QSTNNRTTLN",
            "isRepeatable": false,
            "isVisible": true,
            "order": 0,
            "questions": [
                {
                    "name": "QTN_TYPFNSPCTN_SLCT_GRP_CMPNYDTLS_TMPLT_QSTNNRTTLN",
                    "id": 1,
                    "guid": "2a52bb18-ff63-42e6-be03-84afe116deb7",
                    "sortOrder": 1,
                    "isVisible": true,
                    "isMultiple": true,
                    "text": {
                        "en": "Type of Inspection",
                        "fr": "Type d'inspection"
                    },
                    "type": "select",
                    "response": null,
                    "isSamplingAllowed": false,
                    "samplingRecord": null,
                    "isRepeatable": false,
                    "isRepeated": false,
                    "responseOptions": [
                        {
                            "id": 1,
                            "name": "RSPNS_NTL_QTN_TYPFNSPCTN_SLCT_GRP_CMPNYDTLS_TMPLT_QSTNNRTTLN",
                            "sortOrder": 1,
                            "text": {
                                "en": "Initial",
                                "fr": "nitiale"
                            },
                            "value": "true",
                            "internalComment": {
                                "option": "optional",
                                "value": ""
                            },
                            "externalComment": {
                                "option": "optional",
                                "value": ""
                            },
                            "picture": {
                                "option": "optional",
                                "value": []
                            },
                            "provisions": [],
                            "selectedProvisions": [],
                            "searchProvisions": null,
                            "isProvisionCollapsed": false
                        },
                        {
                            "id": 2,
                            "name": "RSPNS_VRFCTN_QTN_TYPFNSPCTN_SLCT_GRP_CMPNYDTLS_TMPLT_QSTNNRTTLN",
                            "sortOrder": 2,
                            "text": {
                                "en": "Verification",
                                "fr": "Vérification"
                            },
                            "value": "False",
                            "internalComment": {
                                "option": "optional",
                                "value": ""
                            },
                            "externalComment": {
                                "option": "optional",
                                "value": ""
                            },
                            "picture": {
                                "option": "optional",
                                "value": []
                            },
                            "provisions": [],
                            "selectedProvisions": [],
                            "selectedProvisionsTitles": [],
                            "searchProvisions": null,
                            "isProvisionCollapsed": false
                        }
                    ],
                    "validationRules": [
                        {
                            "name": "require",
                            "enabled": true,
                            "type": "require",
                            "value": null,
                            "errorMessage": {
                                "en": "Required",
                                "fr": "FR: Required"
                            }
                        }
                    ],
                    "violationInfo": {
                        "responseToMatch": "false",
                        "matchingType": "equal"
                    },
                    "childQuestions": [],
                    "dependants": [
                        {
                            "guid": "91ad851b-18b9-421f-a5a8-e3ba1b5dc57a"
                        },
                        {
                            "guid": "379230fa-1830-4ef5-9f00-a9e68c60efc0"
                        }
                    ],
                    "dependencyGroups": []
                },
                {
                    "name": "QTN_FNTLNSPCTN,PHYS_RD_GRP_CMPNYDTLS_TMPLT_QSTNNRTTLN",
                    "id": 3,
                    "guid": "91ad851b-18b9-421f-a5a8-e3ba1b5dc57a",
                    "sortOrder": 2,
                    "isVisible": false,
                    "isMultiple": true,
                    "text": {
                        "en": "If initial inspection, physical address matches address on application for registration?",
                        "fr": "S'il s'agit d'une inspection initiale, l'adresse physique correspond à la demande d'inscription? If"
                    },
                    "type": "radio",
                    "response": null,
                    "isSamplingAllowed": false,
                    "samplingRecord": null,
                    "isRepeatable": false,
                    "isRepeated": false,
                    "responseOptions": [
                        {
                            "id": 1,
                            "name": "RSPNS_YS_QTN_FNTLNSPCTN,PHYS_RD_GRP_CMPNYDTLS_TMPLT_QSTNNRTTLN",
                            "sortOrder": 1,
                            "text": {
                                "en": "Yes",
                                "fr": "FR: Yes"
                            },
                            "value": "true",
                            "internalComment": {
                                "option": "optional",
                                "value": ""
                            },
                            "externalComment": {
                                "option": "optional",
                                "value": ""
                            },
                            "picture": {
                                "option": "optional",
                                "value": []
                            },
                            "provisions": [],
                            "selectedProvisions": [],
                            "searchProvisions": null,
                            "isProvisionCollapsed": false
                        },
                        {
                            "id": 2,
                            "name": "RSPNS_N_QTN_FNTLNSPCTN,PHYS_RD_GRP_CMPNYDTLS_TMPLT_QSTNNRTTLN",
                            "sortOrder": 2,
                            "text": {
                                "en": "No",
                                "fr": "FR: No"
                            },
                            "value": "false",
                            "internalComment": {
                                "option": "optional",
                                "value": ""
                            },
                            "externalComment": {
                                "option": "required",
                                "value": ""
                            },
                            "picture": {
                                "option": "optional",
                                "value": []
                            },
                            "provisions": [],
                            "selectedProvisions": [],
                            "selectedProvisionsTitles": [],
                            "searchProvisions": null,
                            "isProvisionCollapsed": false
                        }
                    ],
                    "validationRules": [
                        {
                            "name": "require",
                            "enabled": true,
                            "type": "require",
                            "value": null,
                            "errorMessage": {
                                "en": "Required",
                                "fr": "FR: Required"
                            }
                        }
                    ],
                    "violationInfo": {
                        "responseToMatch": "false",
                        "matchingType": "equal"
                    },
                    "childQuestions": [],
                    "dependants": [],
                    "dependencyGroups": [
                        {
                            "ruleType": "visibility",
                            "childValidatorName": null,
                            "questionDependencies": [
                                {
                                    "dependsOnQuestion": {
                                        "guid": "2a52bb18-ff63-42e6-be03-84afe116deb7"
                                    },
                                    "validationAction": "equal",
                                    "validationValue": "true"
                                }
                            ]
                        }
                    ]
                },
                {
                    "name": "QTN_FVRFCTNNSPCTN,P_RD_GRP_CMPNYDTLS_TMPLT_QSTNNRTTLN",
                    "id": 4,
                    "guid": "379230fa-1830-4ef5-9f00-a9e68c60efc0",
                    "sortOrder": 2,
                    "isVisible": false,
                    "isMultiple": true,
                    "text": {